{
  "run_id": "RUN-0043",
  "schema_version": "2020-12.v1",
  "created_at": "2026-03-31T09:00:00Z",
  "worker": "software-engineering-worker",
  "task": {
    "type": "feature",
    "ref": "OMS-1342",
    "app": "APP-009",
    "repo": "mcg-oms",
    "sprint": 7,
    "family": "order-saga"
  },
  "knowledge_retrieved": [
    "KN-209",
    "KN-307"
  ],
  "experience_retrieved": [
    "EXP-206"
  ],
  "prior_executions": [
    "RUN-0032"
  ],
  "context": {
    "id": "CTX-1043",
    "schema_version": "2020-12.v1",
    "created_at": "2026-03-31T09:00:00Z",
    "task": {
      "type": "jira_story",
      "ref": "OMS-1342",
      "app": "APP-009",
      "repo": "mcg-oms"
    },
    "intent_ref": "PLAN-1043",
    "model_budget": {
      "window_tokens": 200000,
      "reserved_output": 8000
    },
    "included": [
      {
        "source": "KN-209",
        "kind": "knowledge",
        "reason": "relevant order-saga rule/doc",
        "score": 0.81
      },
      {
        "source": "KN-307",
        "kind": "knowledge",
        "reason": "relevant order-saga rule/doc",
        "score": 0.81
      },
      {
        "source": "EXP-206",
        "kind": "experience",
        "reason": "prior order-saga lesson",
        "score": 0.77
      }
    ],
    "excluded": [
      {
        "source": "KN-047",
        "kind": "knowledge",
        "reason": "lower-relevance doc dropped for budget",
        "score": 0.4
      }
    ],
    "coverage_confidence": 0.61,
    "signals": {
      "hit_ratio": 0.6,
      "budget_utilization": 0.58,
      "staleness_index": 0.1
    }
  },
  "decision": {
    "id": "DEC-0043",
    "schema_version": "2020-12.v1",
    "created_at": "2026-03-31T11:00:00Z",
    "plan": "PLAN-1043",
    "choice": "proceed",
    "rationale": "Applied EXP-206; fused confidence adequate.",
    "fused_confidence": 0.63,
    "inputs": {
      "context": 0.61,
      "knowledge": 0.76,
      "experience": 0.62,
      "evaluation": 0.58
    },
    "worker": "software-engineering-worker",
    "trace_seq": 1
  },
  "plan": {
    "id": "PLAN-1043",
    "schema_version": "2020-12.v1",
    "created_at": "2026-03-31T10:00:00Z",
    "task": "OMS-1342",
    "app": "APP-009",
    "intent": "Feature for order-saga: Saga compensations must be idempotent and tested for partial",
    "success_criteria": [
      "Task acceptance criteria met.",
      "No regression of the known failure class.",
      "Applies prior lesson EXP-206"
    ],
    "steps": [
      {
        "n": 1,
        "action": "analyze order-saga change site",
        "tool": "repo"
      },
      {
        "n": 2,
        "action": "implement order-saga change",
        "tool": "repo"
      },
      {
        "n": 3,
        "action": "add regression test for Saga compensations must be idempotent an",
        "tool": "repo"
      },
      {
        "n": 4,
        "action": "run tests",
        "tool": "ci",
        "expect": "TR pass"
      },
      {
        "n": 5,
        "action": "open PR",
        "tool": "github"
      }
    ],
    "rollback": "Feature-flag or revert; expand-contract migration if schema touched.",
    "risk_tier": 0,
    "routing": {
      "model_class": "high-reasoning",
      "reason": "tier 0 order-saga change"
    },
    "applied_experience": [
      "EXP-206"
    ]
  },
  "execution": {
    "id": "EXE-0043",
    "schema_version": "2020-12.v1",
    "created_at": "2026-04-01T14:00:00Z",
    "plan": "PLAN-1043",
    "step": 5,
    "tool": "github",
    "directives": {
      "open_pr": true
    },
    "artifacts": [
      {
        "id": "PR-6043",
        "schema_version": "2020-12.v1",
        "created_at": "2026-04-01T14:00:00Z",
        "artifact_type": "pull_request",
        "ref": "PR-6043",
        "uri": "mcg-oms#6043",
        "repo": "mcg-oms"
      }
    ],
    "status": "succeeded",
    "worker": "software-engineering-worker",
    "run_id": "RUN-0043"
  },
  "evaluation": {
    "id": "EVAL-1043",
    "schema_version": "2020-12.v1",
    "created_at": "2026-04-02T12:00:00Z",
    "execution": "PR-6043",
    "plan": "PLAN-1043",
    "task": "OMS-1342",
    "rubric": {
      "id": "RUBRIC-feature",
      "version": 2
    },
    "objective": [
      {
        "gate": "unit_tests",
        "result": "fail",
        "evidence": "TR-7043",
        "weight": 0.3
      },
      {
        "gate": "coverage",
        "result": "fail",
        "value": 0.79,
        "threshold": 0.8,
        "evidence": "TR-7043",
        "weight": 0.2
      },
      {
        "gate": "dependency_rule",
        "result": "pass",
        "weight": 0.2
      },
      {
        "gate": "security_scan",
        "result": "pass",
        "weight": 0.15
      },
      {
        "gate": "regression_check",
        "result": "pass",
        "weight": 0.15
      }
    ],
    "rubric_items": [
      {
        "item": "order-saga change is correct and maintainable",
        "result": "partial",
        "evidence": "reviewer notes",
        "judgment_confidence": 0.74
      }
    ],
    "verdict": {
      "outcome": "partial",
      "score": 0.58,
      "outcome_confidence": 0.6,
      "judgment_confidence": 0.74
    },
    "regression_check": {
      "reintroduced_defect": false,
      "checked_against": [
        "EXP-206"
      ]
    }
  },
  "reflection": {
    "id": "REF-1043",
    "schema_version": "2020-12.v1",
    "created_at": "2026-04-02T16:00:00Z",
    "evaluation": "EVAL-1043",
    "execution": "PR-6043",
    "plan": "PLAN-1043",
    "what_happened": "order-saga task succeeded, applying accumulated experience.",
    "root_cause": {
      "category": "missing_experience",
      "detail": "Applying EXP-206 kept the order-saga failure class from recurring; loop closed.",
      "confidence": 0.81
    },
    "lessons": [],
    "policy_updates": [],
    "loop_closed_by": "PR-6043"
  },
  "experience_update": {
    "action": "reinforced",
    "experience": "EXP-206",
    "delta": {
      "application_frequency_inc": 1,
      "outcome": "partial"
    }
  },
  "confidence": {
    "context_coverage": 0.61,
    "knowledge_authority": 0.76,
    "experience_applicability": 0.62,
    "evaluation_outcome": 0.58,
    "evaluation_judgment": 0.74,
    "fused": 0.63
  },
  "outcome": "partial"
}
