{
  "run_id": "RUN-0092",
  "schema_version": "2020-12.v1",
  "created_at": "2026-06-23T09:00:00Z",
  "worker": "reliability-worker",
  "task": {
    "type": "hardening",
    "ref": "CHK-1415",
    "app": "APP-003",
    "repo": "mcg-checkout-service",
    "sprint": 13,
    "family": "checkout-latency"
  },
  "knowledge_retrieved": [
    "KN-313",
    "KN-229"
  ],
  "experience_retrieved": [
    "EXP-209"
  ],
  "prior_executions": [
    "RUN-0085"
  ],
  "context": {
    "id": "CTX-1092",
    "schema_version": "2020-12.v1",
    "created_at": "2026-06-23T09:00:00Z",
    "task": {
      "type": "jira_story",
      "ref": "CHK-1415",
      "app": "APP-003",
      "repo": "mcg-checkout-service"
    },
    "intent_ref": "PLAN-1092",
    "model_budget": {
      "window_tokens": 200000,
      "reserved_output": 8000
    },
    "included": [
      {
        "source": "KN-313",
        "kind": "knowledge",
        "reason": "relevant checkout-latency rule/doc",
        "score": 0.88
      },
      {
        "source": "KN-229",
        "kind": "knowledge",
        "reason": "relevant checkout-latency rule/doc",
        "score": 0.88
      },
      {
        "source": "EXP-209",
        "kind": "experience",
        "reason": "prior checkout-latency lesson",
        "score": 0.87
      }
    ],
    "excluded": [],
    "coverage_confidence": 0.85,
    "signals": {
      "hit_ratio": 0.83,
      "budget_utilization": 0.48,
      "staleness_index": 0.1
    }
  },
  "decision": {
    "id": "DEC-0092",
    "schema_version": "2020-12.v1",
    "created_at": "2026-06-23T11:00:00Z",
    "plan": "PLAN-1092",
    "choice": "proceed",
    "rationale": "Applied EXP-209; fused confidence adequate.",
    "fused_confidence": 0.86,
    "inputs": {
      "context": 0.85,
      "knowledge": 0.87,
      "experience": 0.88,
      "evaluation": 0.86
    },
    "worker": "reliability-worker",
    "trace_seq": 1
  },
  "plan": {
    "id": "PLAN-1092",
    "schema_version": "2020-12.v1",
    "created_at": "2026-06-23T10:00:00Z",
    "task": "CHK-1415",
    "app": "APP-003",
    "intent": "Hardening for checkout-latency: Synchronous promo calls on the checkout path must be made as",
    "success_criteria": [
      "Task acceptance criteria met.",
      "No regression of the known failure class.",
      "Applies prior lesson EXP-209"
    ],
    "steps": [
      {
        "n": 1,
        "action": "analyze checkout-latency change site",
        "tool": "repo"
      },
      {
        "n": 2,
        "action": "implement checkout-latency change",
        "tool": "repo"
      },
      {
        "n": 3,
        "action": "add regression test for Synchronous promo calls on the checkout ",
        "tool": "repo"
      },
      {
        "n": 4,
        "action": "run tests",
        "tool": "ci",
        "expect": "TR pass"
      },
      {
        "n": 5,
        "action": "open PR",
        "tool": "github"
      }
    ],
    "rollback": "Feature-flag or revert; expand-contract migration if schema touched.",
    "risk_tier": 0,
    "routing": {
      "model_class": "high-reasoning",
      "reason": "tier 0 checkout-latency change"
    },
    "applied_experience": [
      "EXP-209"
    ]
  },
  "execution": {
    "id": "EXE-0092",
    "schema_version": "2020-12.v1",
    "created_at": "2026-06-24T14:00:00Z",
    "plan": "PLAN-1092",
    "step": 5,
    "tool": "github",
    "directives": {
      "open_pr": true
    },
    "artifacts": [
      {
        "id": "PR-6092",
        "schema_version": "2020-12.v1",
        "created_at": "2026-06-24T14:00:00Z",
        "artifact_type": "pull_request",
        "ref": "PR-6092",
        "uri": "mcg-checkout-service#6092",
        "repo": "mcg-checkout-service"
      }
    ],
    "status": "succeeded",
    "worker": "reliability-worker",
    "run_id": "RUN-0092"
  },
  "evaluation": {
    "id": "EVAL-1092",
    "schema_version": "2020-12.v1",
    "created_at": "2026-06-25T12:00:00Z",
    "execution": "PR-6092",
    "plan": "PLAN-1092",
    "task": "CHK-1415",
    "rubric": {
      "id": "RUBRIC-hardening",
      "version": 2
    },
    "objective": [
      {
        "gate": "unit_tests",
        "result": "pass",
        "evidence": "TR-7092",
        "weight": 0.3
      },
      {
        "gate": "coverage",
        "result": "pass",
        "value": 0.86,
        "threshold": 0.8,
        "evidence": "TR-7092",
        "weight": 0.2
      },
      {
        "gate": "dependency_rule",
        "result": "pass",
        "weight": 0.2
      },
      {
        "gate": "security_scan",
        "result": "pass",
        "weight": 0.15
      },
      {
        "gate": "regression_check",
        "result": "pass",
        "weight": 0.15
      }
    ],
    "rubric_items": [
      {
        "item": "checkout-latency change is correct and maintainable",
        "result": "pass",
        "evidence": "reviewer notes",
        "judgment_confidence": 0.87
      }
    ],
    "verdict": {
      "outcome": "pass",
      "score": 0.86,
      "outcome_confidence": 0.88,
      "judgment_confidence": 0.87
    },
    "regression_check": {
      "reintroduced_defect": false,
      "checked_against": [
        "EXP-209"
      ]
    }
  },
  "reflection": {
    "id": "REF-1092",
    "schema_version": "2020-12.v1",
    "created_at": "2026-06-25T16:00:00Z",
    "evaluation": "EVAL-1092",
    "execution": "PR-6092",
    "plan": "PLAN-1092",
    "what_happened": "checkout-latency task succeeded, applying accumulated experience.",
    "root_cause": {
      "category": "missing_experience",
      "detail": "Applying EXP-209 kept the checkout-latency failure class from recurring; loop closed.",
      "confidence": 0.88
    },
    "lessons": [],
    "policy_updates": [],
    "loop_closed_by": "PR-6092"
  },
  "experience_update": {
    "action": "reinforced",
    "experience": "EXP-209",
    "delta": {
      "application_frequency_inc": 1,
      "outcome": "pass"
    }
  },
  "confidence": {
    "context_coverage": 0.85,
    "knowledge_authority": 0.87,
    "experience_applicability": 0.88,
    "evaluation_outcome": 0.86,
    "evaluation_judgment": 0.87,
    "fused": 0.86
  },
  "outcome": "pass"
}
