{
  "run_id": "RUN-0076",
  "schema_version": "2020-12.v1",
  "created_at": "2026-05-12T09:00:00Z",
  "worker": "software-engineering-worker",
  "task": {
    "type": "bugfix",
    "ref": "PRM-1024",
    "app": "APP-008",
    "repo": "mcg-promotions-engine",
    "sprint": 10,
    "family": "promo-cache"
  },
  "knowledge_retrieved": [
    "KN-063",
    "KN-304"
  ],
  "experience_retrieved": [
    "EXP-055"
  ],
  "prior_executions": [
    "RUN-0066"
  ],
  "context": {
    "id": "CTX-1076",
    "schema_version": "2020-12.v1",
    "created_at": "2026-05-12T09:00:00Z",
    "task": {
      "type": "jira_story",
      "ref": "PRM-1024",
      "app": "APP-008",
      "repo": "mcg-promotions-engine"
    },
    "intent_ref": "PLAN-1076",
    "model_budget": {
      "window_tokens": 200000,
      "reserved_output": 8000
    },
    "included": [
      {
        "source": "KN-063",
        "kind": "knowledge",
        "reason": "relevant promo-cache rule/doc",
        "score": 0.87
      },
      {
        "source": "KN-304",
        "kind": "knowledge",
        "reason": "relevant promo-cache rule/doc",
        "score": 0.87
      },
      {
        "source": "EXP-055",
        "kind": "experience",
        "reason": "prior promo-cache lesson",
        "score": 0.85
      }
    ],
    "excluded": [],
    "coverage_confidence": 0.79,
    "signals": {
      "hit_ratio": 0.78,
      "budget_utilization": 0.5,
      "staleness_index": 0.1
    }
  },
  "decision": {
    "id": "DEC-0076",
    "schema_version": "2020-12.v1",
    "created_at": "2026-05-12T11:00:00Z",
    "plan": "PLAN-1076",
    "choice": "proceed",
    "rationale": "Applied EXP-055; fused confidence adequate.",
    "fused_confidence": 0.79,
    "inputs": {
      "context": 0.79,
      "knowledge": 0.82,
      "experience": 0.8,
      "evaluation": 0.77
    },
    "worker": "software-engineering-worker",
    "trace_seq": 1
  },
  "plan": {
    "id": "PLAN-1076",
    "schema_version": "2020-12.v1",
    "created_at": "2026-05-12T10:00:00Z",
    "task": "PRM-1024",
    "app": "APP-008",
    "intent": "Bugfix for promo-cache: Pricing/promotion changes during a promo window require a wr",
    "success_criteria": [
      "Task acceptance criteria met.",
      "No regression of the known failure class.",
      "Applies prior lesson EXP-055"
    ],
    "steps": [
      {
        "n": 1,
        "action": "analyze promo-cache change site",
        "tool": "repo"
      },
      {
        "n": 2,
        "action": "implement promo-cache change",
        "tool": "repo"
      },
      {
        "n": 3,
        "action": "add regression test for Pricing/promotion changes during a promo",
        "tool": "repo"
      },
      {
        "n": 4,
        "action": "run tests",
        "tool": "ci",
        "expect": "TR pass"
      },
      {
        "n": 5,
        "action": "open PR",
        "tool": "github"
      }
    ],
    "rollback": "Feature-flag or revert; expand-contract migration if schema touched.",
    "risk_tier": 1,
    "routing": {
      "model_class": "balanced",
      "reason": "tier 1 promo-cache change"
    },
    "applied_experience": [
      "EXP-055"
    ]
  },
  "execution": {
    "id": "EXE-0076",
    "schema_version": "2020-12.v1",
    "created_at": "2026-05-13T14:00:00Z",
    "plan": "PLAN-1076",
    "step": 5,
    "tool": "github",
    "directives": {
      "open_pr": true
    },
    "artifacts": [
      {
        "id": "PR-6076",
        "schema_version": "2020-12.v1",
        "created_at": "2026-05-13T14:00:00Z",
        "artifact_type": "pull_request",
        "ref": "PR-6076",
        "uri": "mcg-promotions-engine#6076",
        "repo": "mcg-promotions-engine"
      }
    ],
    "status": "succeeded",
    "worker": "software-engineering-worker",
    "run_id": "RUN-0076"
  },
  "evaluation": {
    "id": "EVAL-1076",
    "schema_version": "2020-12.v1",
    "created_at": "2026-05-14T12:00:00Z",
    "execution": "PR-6076",
    "plan": "PLAN-1076",
    "task": "PRM-1024",
    "rubric": {
      "id": "RUBRIC-bugfix",
      "version": 2
    },
    "objective": [
      {
        "gate": "unit_tests",
        "result": "pass",
        "evidence": "TR-7076",
        "weight": 0.3
      },
      {
        "gate": "coverage",
        "result": "pass",
        "value": 0.85,
        "threshold": 0.8,
        "evidence": "TR-7076",
        "weight": 0.2
      },
      {
        "gate": "dependency_rule",
        "result": "pass",
        "weight": 0.2
      },
      {
        "gate": "security_scan",
        "result": "pass",
        "weight": 0.15
      },
      {
        "gate": "regression_check",
        "result": "pass",
        "weight": 0.15
      }
    ],
    "rubric_items": [
      {
        "item": "promo-cache change is correct and maintainable",
        "result": "pass",
        "evidence": "reviewer notes",
        "judgment_confidence": 0.85
      }
    ],
    "verdict": {
      "outcome": "pass",
      "score": 0.77,
      "outcome_confidence": 0.79,
      "judgment_confidence": 0.85
    },
    "regression_check": {
      "reintroduced_defect": false,
      "checked_against": [
        "EXP-055"
      ]
    }
  },
  "reflection": {
    "id": "REF-1076",
    "schema_version": "2020-12.v1",
    "created_at": "2026-05-14T16:00:00Z",
    "evaluation": "EVAL-1076",
    "execution": "PR-6076",
    "plan": "PLAN-1076",
    "what_happened": "promo-cache task succeeded, applying accumulated experience.",
    "root_cause": {
      "category": "missing_experience",
      "detail": "Applying EXP-055 kept the promo-cache failure class from recurring; loop closed.",
      "confidence": 0.87
    },
    "lessons": [],
    "policy_updates": [],
    "loop_closed_by": "PR-6076"
  },
  "experience_update": {
    "action": "reinforced",
    "experience": "EXP-055",
    "delta": {
      "application_frequency_inc": 1,
      "outcome": "pass"
    }
  },
  "confidence": {
    "context_coverage": 0.79,
    "knowledge_authority": 0.82,
    "experience_applicability": 0.8,
    "evaluation_outcome": 0.77,
    "evaluation_judgment": 0.85,
    "fused": 0.79
  },
  "outcome": "pass"
}
