{
  "run_id": "RUN-0023",
  "schema_version": "2020-12.v1",
  "created_at": "2026-03-03T09:00:00Z",
  "worker": "software-engineering-worker",
  "task": {
    "type": "feature",
    "ref": "PAY-991",
    "app": "APP-012",
    "repo": "mcg-payments-service",
    "sprint": 5,
    "family": "payments-3ds"
  },
  "knowledge_retrieved": [
    "KN-052",
    "KN-258"
  ],
  "experience_retrieved": [],
  "prior_executions": [],
  "context": {
    "id": "CTX-1023",
    "schema_version": "2020-12.v1",
    "created_at": "2026-03-03T09:00:00Z",
    "task": {
      "type": "jira_story",
      "ref": "PAY-991",
      "app": "APP-012",
      "repo": "mcg-payments-service"
    },
    "intent_ref": "PLAN-1023",
    "model_budget": {
      "window_tokens": 200000,
      "reserved_output": 8000
    },
    "included": [
      {
        "source": "KN-052",
        "kind": "knowledge",
        "reason": "relevant payments-3ds rule/doc",
        "score": 0.8
      },
      {
        "source": "KN-258",
        "kind": "knowledge",
        "reason": "relevant payments-3ds rule/doc",
        "score": 0.8
      }
    ],
    "excluded": [
      {
        "source": "KN-047",
        "kind": "knowledge",
        "reason": "lower-relevance doc dropped for budget",
        "score": 0.4
      }
    ],
    "coverage_confidence": 0.54,
    "signals": {
      "hit_ratio": 0.55,
      "budget_utilization": 0.6,
      "staleness_index": 0.1
    }
  },
  "decision": {
    "id": "DEC-0023",
    "schema_version": "2020-12.v1",
    "created_at": "2026-03-03T11:00:00Z",
    "plan": "PLAN-1023",
    "choice": "proceed",
    "rationale": "Cold start for this family; limited prior experience.",
    "fused_confidence": 0.6,
    "inputs": {
      "context": 0.54,
      "knowledge": 0.69,
      "experience": 0.0,
      "evaluation": 0.57
    },
    "worker": "software-engineering-worker",
    "trace_seq": 1
  },
  "plan": {
    "id": "PLAN-1023",
    "schema_version": "2020-12.v1",
    "created_at": "2026-03-03T10:00:00Z",
    "task": "PAY-991",
    "app": "APP-012",
    "intent": "Feature for payments-3ds: 3DS challenge flows need PSP-sandbox contract tests to preve",
    "success_criteria": [
      "Task acceptance criteria met.",
      "No regression of the known failure class."
    ],
    "steps": [
      {
        "n": 1,
        "action": "analyze payments-3ds change site",
        "tool": "repo"
      },
      {
        "n": 2,
        "action": "implement payments-3ds change",
        "tool": "repo"
      },
      {
        "n": 3,
        "action": "run tests",
        "tool": "ci",
        "expect": "TR pass"
      },
      {
        "n": 4,
        "action": "open PR",
        "tool": "github"
      }
    ],
    "rollback": "Feature-flag or revert; expand-contract migration if schema touched.",
    "risk_tier": 0,
    "routing": {
      "model_class": "high-reasoning",
      "reason": "tier 0 payments-3ds change"
    }
  },
  "execution": {
    "id": "EXE-0023",
    "schema_version": "2020-12.v1",
    "created_at": "2026-03-04T14:00:00Z",
    "plan": "PLAN-1023",
    "step": 4,
    "tool": "github",
    "directives": {
      "open_pr": true
    },
    "artifacts": [
      {
        "id": "PR-6023",
        "schema_version": "2020-12.v1",
        "created_at": "2026-03-04T14:00:00Z",
        "artifact_type": "pull_request",
        "ref": "PR-6023",
        "uri": "mcg-payments-service#6023",
        "repo": "mcg-payments-service"
      }
    ],
    "status": "partial",
    "worker": "software-engineering-worker",
    "run_id": "RUN-0023"
  },
  "evaluation": {
    "id": "EVAL-1023",
    "schema_version": "2020-12.v1",
    "created_at": "2026-03-05T12:00:00Z",
    "execution": "PR-6023",
    "plan": "PLAN-1023",
    "task": "PAY-991",
    "rubric": {
      "id": "RUBRIC-feature",
      "version": 2
    },
    "objective": [
      {
        "gate": "unit_tests",
        "result": "fail",
        "evidence": "TR-7023",
        "weight": 0.3
      },
      {
        "gate": "coverage",
        "result": "fail",
        "value": 0.78,
        "threshold": 0.8,
        "evidence": "TR-7023",
        "weight": 0.2
      },
      {
        "gate": "dependency_rule",
        "result": "pass",
        "weight": 0.2
      },
      {
        "gate": "security_scan",
        "result": "pass",
        "weight": 0.15
      },
      {
        "gate": "regression_check",
        "result": "fail",
        "note": "payments-3ds failure class not yet guarded",
        "weight": 0.15
      }
    ],
    "rubric_items": [
      {
        "item": "payments-3ds change is correct and maintainable",
        "result": "fail",
        "evidence": "reviewer notes",
        "judgment_confidence": 0.74
      }
    ],
    "verdict": {
      "outcome": "fail",
      "score": 0.57,
      "outcome_confidence": 0.59,
      "judgment_confidence": 0.74
    },
    "regression_check": {
      "reintroduced_defect": true,
      "checked_against": []
    }
  },
  "reflection": {
    "id": "REF-1023",
    "schema_version": "2020-12.v1",
    "created_at": "2026-03-05T16:00:00Z",
    "evaluation": "EVAL-1023",
    "execution": "PR-6023",
    "plan": "PLAN-1023",
    "what_happened": "payments-3ds task failed the regression class and produced a new lesson.",
    "root_cause": {
      "category": "missing_experience",
      "detail": "The payments-3ds failure class was not guarded; distilling a lesson to prevent recurrence.",
      "confidence": 0.75
    },
    "lessons": [
      {
        "create_experience": "EXP-202"
      }
    ],
    "policy_updates": [
      {
        "context": "raise retrieval priority of payments-3ds rules"
      },
      {
        "planning": "add regression assertion for this failure class"
      }
    ]
  },
  "experience_update": {
    "action": "created",
    "experience": "EXP-202",
    "delta": {
      "reason": "distilled from first payments-3ds run"
    }
  },
  "confidence": {
    "context_coverage": 0.54,
    "knowledge_authority": 0.69,
    "experience_applicability": 0.0,
    "evaluation_outcome": 0.57,
    "evaluation_judgment": 0.74,
    "fused": 0.6
  },
  "outcome": "fail"
}
