{
  "run_id": "RUN-0062",
  "schema_version": "2020-12.v1",
  "created_at": "2026-04-28T09:00:00Z",
  "worker": "software-engineering-worker",
  "task": {
    "type": "bugfix",
    "ref": "INV-1234",
    "app": "APP-010",
    "repo": "mcg-inventory-service",
    "sprint": 9,
    "family": "inventory-atp"
  },
  "knowledge_retrieved": [
    "KN-307",
    "KN-210"
  ],
  "experience_retrieved": [
    "EXP-203"
  ],
  "prior_executions": [
    "RUN-0052"
  ],
  "context": {
    "id": "CTX-1062",
    "schema_version": "2020-12.v1",
    "created_at": "2026-04-28T09:00:00Z",
    "task": {
      "type": "jira_story",
      "ref": "INV-1234",
      "app": "APP-010",
      "repo": "mcg-inventory-service"
    },
    "intent_ref": "PLAN-1062",
    "model_budget": {
      "window_tokens": 200000,
      "reserved_output": 8000
    },
    "included": [
      {
        "source": "KN-307",
        "kind": "knowledge",
        "reason": "relevant inventory-atp rule/doc",
        "score": 0.84
      },
      {
        "source": "KN-210",
        "kind": "knowledge",
        "reason": "relevant inventory-atp rule/doc",
        "score": 0.84
      },
      {
        "source": "EXP-203",
        "kind": "experience",
        "reason": "prior inventory-atp lesson",
        "score": 0.81
      }
    ],
    "excluded": [
      {
        "source": "KN-047",
        "kind": "knowledge",
        "reason": "lower-relevance doc dropped for budget",
        "score": 0.4
      }
    ],
    "coverage_confidence": 0.75,
    "signals": {
      "hit_ratio": 0.7,
      "budget_utilization": 0.54,
      "staleness_index": 0.1
    }
  },
  "decision": {
    "id": "DEC-0062",
    "schema_version": "2020-12.v1",
    "created_at": "2026-04-28T11:00:00Z",
    "plan": "PLAN-1062",
    "choice": "proceed",
    "rationale": "Applied EXP-203; fused confidence adequate.",
    "fused_confidence": 0.77,
    "inputs": {
      "context": 0.75,
      "knowledge": 0.8,
      "experience": 0.77,
      "evaluation": 0.76
    },
    "worker": "software-engineering-worker",
    "trace_seq": 1
  },
  "plan": {
    "id": "PLAN-1062",
    "schema_version": "2020-12.v1",
    "created_at": "2026-04-28T10:00:00Z",
    "task": "INV-1234",
    "app": "APP-010",
    "intent": "Bugfix for inventory-atp: Multi-warehouse ATP requires reservation locks to prevent ov",
    "success_criteria": [
      "Task acceptance criteria met.",
      "No regression of the known failure class.",
      "Applies prior lesson EXP-203"
    ],
    "steps": [
      {
        "n": 1,
        "action": "analyze inventory-atp change site",
        "tool": "repo"
      },
      {
        "n": 2,
        "action": "implement inventory-atp change",
        "tool": "repo"
      },
      {
        "n": 3,
        "action": "add regression test for Multi-warehouse ATP requires reservation",
        "tool": "repo"
      },
      {
        "n": 4,
        "action": "run tests",
        "tool": "ci",
        "expect": "TR pass"
      },
      {
        "n": 5,
        "action": "open PR",
        "tool": "github"
      }
    ],
    "rollback": "Feature-flag or revert; expand-contract migration if schema touched.",
    "risk_tier": 0,
    "routing": {
      "model_class": "high-reasoning",
      "reason": "tier 0 inventory-atp change"
    },
    "applied_experience": [
      "EXP-203"
    ]
  },
  "execution": {
    "id": "EXE-0062",
    "schema_version": "2020-12.v1",
    "created_at": "2026-04-29T14:00:00Z",
    "plan": "PLAN-1062",
    "step": 5,
    "tool": "github",
    "directives": {
      "open_pr": true
    },
    "artifacts": [
      {
        "id": "PR-6062",
        "schema_version": "2020-12.v1",
        "created_at": "2026-04-29T14:00:00Z",
        "artifact_type": "pull_request",
        "ref": "PR-6062",
        "uri": "mcg-inventory-service#6062",
        "repo": "mcg-inventory-service"
      }
    ],
    "status": "succeeded",
    "worker": "software-engineering-worker",
    "run_id": "RUN-0062"
  },
  "evaluation": {
    "id": "EVAL-1062",
    "schema_version": "2020-12.v1",
    "created_at": "2026-04-30T12:00:00Z",
    "execution": "PR-6062",
    "plan": "PLAN-1062",
    "task": "INV-1234",
    "rubric": {
      "id": "RUBRIC-bugfix",
      "version": 2
    },
    "objective": [
      {
        "gate": "unit_tests",
        "result": "pass",
        "evidence": "TR-7062",
        "weight": 0.3
      },
      {
        "gate": "coverage",
        "result": "pass",
        "value": 0.82,
        "threshold": 0.8,
        "evidence": "TR-7062",
        "weight": 0.2
      },
      {
        "gate": "dependency_rule",
        "result": "pass",
        "weight": 0.2
      },
      {
        "gate": "security_scan",
        "result": "pass",
        "weight": 0.15
      },
      {
        "gate": "regression_check",
        "result": "pass",
        "weight": 0.15
      }
    ],
    "rubric_items": [
      {
        "item": "inventory-atp change is correct and maintainable",
        "result": "pass",
        "evidence": "reviewer notes",
        "judgment_confidence": 0.83
      }
    ],
    "verdict": {
      "outcome": "pass",
      "score": 0.76,
      "outcome_confidence": 0.78,
      "judgment_confidence": 0.83
    },
    "regression_check": {
      "reintroduced_defect": false,
      "checked_against": [
        "EXP-203"
      ]
    }
  },
  "reflection": {
    "id": "REF-1062",
    "schema_version": "2020-12.v1",
    "created_at": "2026-04-30T16:00:00Z",
    "evaluation": "EVAL-1062",
    "execution": "PR-6062",
    "plan": "PLAN-1062",
    "what_happened": "inventory-atp task succeeded, applying accumulated experience.",
    "root_cause": {
      "category": "missing_experience",
      "detail": "Applying EXP-203 kept the inventory-atp failure class from recurring; loop closed.",
      "confidence": 0.84
    },
    "lessons": [],
    "policy_updates": [],
    "loop_closed_by": "PR-6062"
  },
  "experience_update": {
    "action": "reinforced",
    "experience": "EXP-203",
    "delta": {
      "application_frequency_inc": 1,
      "outcome": "pass"
    }
  },
  "confidence": {
    "context_coverage": 0.75,
    "knowledge_authority": 0.8,
    "experience_applicability": 0.77,
    "evaluation_outcome": 0.76,
    "evaluation_judgment": 0.83,
    "fused": 0.77
  },
  "outcome": "pass"
}
