{
  "run_id": "RUN-0032",
  "schema_version": "2020-12.v1",
  "created_at": "2026-03-17T09:00:00Z",
  "worker": "software-engineering-worker",
  "task": {
    "type": "feature",
    "ref": "OMS-1355",
    "app": "APP-009",
    "repo": "mcg-oms",
    "sprint": 6,
    "family": "order-saga"
  },
  "knowledge_retrieved": [
    "KN-209",
    "KN-307"
  ],
  "experience_retrieved": [],
  "prior_executions": [],
  "context": {
    "id": "CTX-1032",
    "schema_version": "2020-12.v1",
    "created_at": "2026-03-17T09:00:00Z",
    "task": {
      "type": "jira_story",
      "ref": "OMS-1355",
      "app": "APP-009",
      "repo": "mcg-oms"
    },
    "intent_ref": "PLAN-1032",
    "model_budget": {
      "window_tokens": 200000,
      "reserved_output": 8000
    },
    "included": [
      {
        "source": "KN-209",
        "kind": "knowledge",
        "reason": "relevant order-saga rule/doc",
        "score": 0.8
      },
      {
        "source": "KN-307",
        "kind": "knowledge",
        "reason": "relevant order-saga rule/doc",
        "score": 0.8
      }
    ],
    "excluded": [
      {
        "source": "KN-047",
        "kind": "knowledge",
        "reason": "lower-relevance doc dropped for budget",
        "score": 0.4
      }
    ],
    "coverage_confidence": 0.53,
    "signals": {
      "hit_ratio": 0.55,
      "budget_utilization": 0.6,
      "staleness_index": 0.1
    }
  },
  "decision": {
    "id": "DEC-0032",
    "schema_version": "2020-12.v1",
    "created_at": "2026-03-17T11:00:00Z",
    "plan": "PLAN-1032",
    "choice": "proceed",
    "rationale": "Cold start for this family; limited prior experience.",
    "fused_confidence": 0.57,
    "inputs": {
      "context": 0.53,
      "knowledge": 0.67,
      "experience": 0.0,
      "evaluation": 0.5
    },
    "worker": "software-engineering-worker",
    "trace_seq": 1
  },
  "plan": {
    "id": "PLAN-1032",
    "schema_version": "2020-12.v1",
    "created_at": "2026-03-17T10:00:00Z",
    "task": "OMS-1355",
    "app": "APP-009",
    "intent": "Feature for order-saga: Saga compensations must be idempotent and tested for partial",
    "success_criteria": [
      "Task acceptance criteria met.",
      "No regression of the known failure class."
    ],
    "steps": [
      {
        "n": 1,
        "action": "analyze order-saga change site",
        "tool": "repo"
      },
      {
        "n": 2,
        "action": "implement order-saga change",
        "tool": "repo"
      },
      {
        "n": 3,
        "action": "run tests",
        "tool": "ci",
        "expect": "TR pass"
      },
      {
        "n": 4,
        "action": "open PR",
        "tool": "github"
      }
    ],
    "rollback": "Feature-flag or revert; expand-contract migration if schema touched.",
    "risk_tier": 0,
    "routing": {
      "model_class": "high-reasoning",
      "reason": "tier 0 order-saga change"
    }
  },
  "execution": {
    "id": "EXE-0032",
    "schema_version": "2020-12.v1",
    "created_at": "2026-03-18T14:00:00Z",
    "plan": "PLAN-1032",
    "step": 4,
    "tool": "github",
    "directives": {
      "open_pr": true
    },
    "artifacts": [
      {
        "id": "PR-6032",
        "schema_version": "2020-12.v1",
        "created_at": "2026-03-18T14:00:00Z",
        "artifact_type": "pull_request",
        "ref": "PR-6032",
        "uri": "mcg-oms#6032",
        "repo": "mcg-oms"
      }
    ],
    "status": "partial",
    "worker": "software-engineering-worker",
    "run_id": "RUN-0032"
  },
  "evaluation": {
    "id": "EVAL-1032",
    "schema_version": "2020-12.v1",
    "created_at": "2026-03-19T12:00:00Z",
    "execution": "PR-6032",
    "plan": "PLAN-1032",
    "task": "OMS-1355",
    "rubric": {
      "id": "RUBRIC-feature",
      "version": 2
    },
    "objective": [
      {
        "gate": "unit_tests",
        "result": "fail",
        "evidence": "TR-7032",
        "weight": 0.3
      },
      {
        "gate": "coverage",
        "result": "fail",
        "value": 0.78,
        "threshold": 0.8,
        "evidence": "TR-7032",
        "weight": 0.2
      },
      {
        "gate": "dependency_rule",
        "result": "pass",
        "weight": 0.2
      },
      {
        "gate": "security_scan",
        "result": "pass",
        "weight": 0.15
      },
      {
        "gate": "regression_check",
        "result": "fail",
        "note": "order-saga failure class not yet guarded",
        "weight": 0.15
      }
    ],
    "rubric_items": [
      {
        "item": "order-saga change is correct and maintainable",
        "result": "fail",
        "evidence": "reviewer notes",
        "judgment_confidence": 0.69
      }
    ],
    "verdict": {
      "outcome": "fail",
      "score": 0.5,
      "outcome_confidence": 0.52,
      "judgment_confidence": 0.69
    },
    "regression_check": {
      "reintroduced_defect": true,
      "checked_against": []
    }
  },
  "reflection": {
    "id": "REF-1032",
    "schema_version": "2020-12.v1",
    "created_at": "2026-03-19T16:00:00Z",
    "evaluation": "EVAL-1032",
    "execution": "PR-6032",
    "plan": "PLAN-1032",
    "what_happened": "order-saga task failed the regression class and produced a new lesson.",
    "root_cause": {
      "category": "missing_experience",
      "detail": "The order-saga failure class was not guarded; distilling a lesson to prevent recurrence.",
      "confidence": 0.75
    },
    "lessons": [
      {
        "create_experience": "EXP-206"
      }
    ],
    "policy_updates": [
      {
        "context": "raise retrieval priority of order-saga rules"
      },
      {
        "planning": "add regression assertion for this failure class"
      }
    ]
  },
  "experience_update": {
    "action": "created",
    "experience": "EXP-206",
    "delta": {
      "reason": "distilled from first order-saga run"
    }
  },
  "confidence": {
    "context_coverage": 0.53,
    "knowledge_authority": 0.67,
    "experience_applicability": 0.0,
    "evaluation_outcome": 0.5,
    "evaluation_judgment": 0.69,
    "fused": 0.57
  },
  "outcome": "fail"
}
