{
  "run_id": "RUN-0006",
  "schema_version": "2020-12.v1",
  "created_at": "2026-01-20T09:00:00Z",
  "worker": "software-engineering-worker",
  "task": {
    "type": "feature",
    "ref": "SRCH-747",
    "app": "APP-006",
    "repo": "mcg-search-service",
    "sprint": 2,
    "family": "search-relevance"
  },
  "knowledge_retrieved": [
    "KN-204",
    "KN-302"
  ],
  "experience_retrieved": [],
  "prior_executions": [],
  "context": {
    "id": "CTX-1006",
    "schema_version": "2020-12.v1",
    "created_at": "2026-01-20T09:00:00Z",
    "task": {
      "type": "jira_story",
      "ref": "SRCH-747",
      "app": "APP-006",
      "repo": "mcg-search-service"
    },
    "intent_ref": "PLAN-1006",
    "model_budget": {
      "window_tokens": 200000,
      "reserved_output": 8000
    },
    "included": [
      {
        "source": "KN-204",
        "kind": "knowledge",
        "reason": "relevant search-relevance rule/doc",
        "score": 0.8
      },
      {
        "source": "KN-302",
        "kind": "knowledge",
        "reason": "relevant search-relevance rule/doc",
        "score": 0.8
      }
    ],
    "excluded": [
      {
        "source": "KN-047",
        "kind": "knowledge",
        "reason": "lower-relevance doc dropped for budget",
        "score": 0.4
      }
    ],
    "coverage_confidence": 0.55,
    "signals": {
      "hit_ratio": 0.55,
      "budget_utilization": 0.6,
      "staleness_index": 0.1
    }
  },
  "decision": {
    "id": "DEC-0006",
    "schema_version": "2020-12.v1",
    "created_at": "2026-01-20T11:00:00Z",
    "plan": "PLAN-1006",
    "choice": "proceed",
    "rationale": "Cold start for this family; limited prior experience.",
    "fused_confidence": 0.61,
    "inputs": {
      "context": 0.55,
      "knowledge": 0.72,
      "experience": 0.0,
      "evaluation": 0.54
    },
    "worker": "software-engineering-worker",
    "trace_seq": 1
  },
  "plan": {
    "id": "PLAN-1006",
    "schema_version": "2020-12.v1",
    "created_at": "2026-01-20T10:00:00Z",
    "task": "SRCH-747",
    "app": "APP-006",
    "intent": "Feature for search-relevance: Relevance changes need offline judgment-set evaluation befor",
    "success_criteria": [
      "Task acceptance criteria met.",
      "No regression of the known failure class."
    ],
    "steps": [
      {
        "n": 1,
        "action": "analyze search-relevance change site",
        "tool": "repo"
      },
      {
        "n": 2,
        "action": "implement search-relevance change",
        "tool": "repo"
      },
      {
        "n": 3,
        "action": "run tests",
        "tool": "ci",
        "expect": "TR pass"
      },
      {
        "n": 4,
        "action": "open PR",
        "tool": "github"
      }
    ],
    "rollback": "Feature-flag or revert; expand-contract migration if schema touched.",
    "risk_tier": 0,
    "routing": {
      "model_class": "high-reasoning",
      "reason": "tier 0 search-relevance change"
    }
  },
  "execution": {
    "id": "EXE-0006",
    "schema_version": "2020-12.v1",
    "created_at": "2026-01-21T14:00:00Z",
    "plan": "PLAN-1006",
    "step": 4,
    "tool": "github",
    "directives": {
      "open_pr": true
    },
    "artifacts": [
      {
        "id": "PR-6006",
        "schema_version": "2020-12.v1",
        "created_at": "2026-01-21T14:00:00Z",
        "artifact_type": "pull_request",
        "ref": "PR-6006",
        "uri": "mcg-search-service#6006",
        "repo": "mcg-search-service"
      }
    ],
    "status": "partial",
    "worker": "software-engineering-worker",
    "run_id": "RUN-0006"
  },
  "evaluation": {
    "id": "EVAL-1006",
    "schema_version": "2020-12.v1",
    "created_at": "2026-01-22T12:00:00Z",
    "execution": "PR-6006",
    "plan": "PLAN-1006",
    "task": "SRCH-747",
    "rubric": {
      "id": "RUBRIC-feature",
      "version": 2
    },
    "objective": [
      {
        "gate": "unit_tests",
        "result": "fail",
        "evidence": "TR-7006",
        "weight": 0.3
      },
      {
        "gate": "coverage",
        "result": "fail",
        "value": 0.78,
        "threshold": 0.8,
        "evidence": "TR-7006",
        "weight": 0.2
      },
      {
        "gate": "dependency_rule",
        "result": "pass",
        "weight": 0.2
      },
      {
        "gate": "security_scan",
        "result": "pass",
        "weight": 0.15
      },
      {
        "gate": "regression_check",
        "result": "fail",
        "note": "search-relevance failure class not yet guarded",
        "weight": 0.15
      }
    ],
    "rubric_items": [
      {
        "item": "search-relevance change is correct and maintainable",
        "result": "fail",
        "evidence": "reviewer notes",
        "judgment_confidence": 0.74
      }
    ],
    "verdict": {
      "outcome": "fail",
      "score": 0.54,
      "outcome_confidence": 0.56,
      "judgment_confidence": 0.74
    },
    "regression_check": {
      "reintroduced_defect": true,
      "checked_against": []
    }
  },
  "reflection": {
    "id": "REF-1006",
    "schema_version": "2020-12.v1",
    "created_at": "2026-01-22T16:00:00Z",
    "evaluation": "EVAL-1006",
    "execution": "PR-6006",
    "plan": "PLAN-1006",
    "what_happened": "search-relevance task failed the regression class and produced a new lesson.",
    "root_cause": {
      "category": "missing_experience",
      "detail": "The search-relevance failure class was not guarded; distilling a lesson to prevent recurrence.",
      "confidence": 0.75
    },
    "lessons": [
      {
        "create_experience": "EXP-204"
      }
    ],
    "policy_updates": [
      {
        "context": "raise retrieval priority of search-relevance rules"
      },
      {
        "planning": "add regression assertion for this failure class"
      }
    ]
  },
  "experience_update": {
    "action": "created",
    "experience": "EXP-204",
    "delta": {
      "reason": "distilled from first search-relevance run"
    }
  },
  "confidence": {
    "context_coverage": 0.55,
    "knowledge_authority": 0.72,
    "experience_applicability": 0.0,
    "evaluation_outcome": 0.54,
    "evaluation_judgment": 0.74,
    "fused": 0.61
  },
  "outcome": "fail"
}
