{
  "run_id": "RUN-0037",
  "schema_version": "2020-12.v1",
  "created_at": "2026-03-17T09:00:00Z",
  "worker": "qa-worker",
  "task": {
    "type": "test_authoring",
    "ref": "SRCH-741",
    "app": "APP-006",
    "repo": "mcg-search-service",
    "sprint": 6,
    "family": "test-authoring"
  },
  "knowledge_retrieved": [
    "KN-204"
  ],
  "experience_retrieved": [
    "EXP-142"
  ],
  "prior_executions": [
    "RUN-0027"
  ],
  "context": {
    "id": "CTX-1037",
    "schema_version": "2020-12.v1",
    "created_at": "2026-03-17T09:00:00Z",
    "task": {
      "type": "jira_story",
      "ref": "SRCH-741",
      "app": "APP-006",
      "repo": "mcg-search-service"
    },
    "intent_ref": "PLAN-1037",
    "model_budget": {
      "window_tokens": 200000,
      "reserved_output": 8000
    },
    "included": [
      {
        "source": "KN-204",
        "kind": "knowledge",
        "reason": "relevant test-authoring rule/doc",
        "score": 0.85
      },
      {
        "source": "EXP-142",
        "kind": "experience",
        "reason": "prior test-authoring lesson",
        "score": 0.82
      }
    ],
    "excluded": [
      {
        "source": "KN-047",
        "kind": "knowledge",
        "reason": "lower-relevance doc dropped for budget",
        "score": 0.4
      }
    ],
    "coverage_confidence": 0.78,
    "signals": {
      "hit_ratio": 0.73,
      "budget_utilization": 0.53,
      "staleness_index": 0.1
    }
  },
  "decision": {
    "id": "DEC-0037",
    "schema_version": "2020-12.v1",
    "created_at": "2026-03-17T11:00:00Z",
    "plan": "PLAN-1037",
    "choice": "proceed",
    "rationale": "Applied EXP-142; fused confidence adequate.",
    "fused_confidence": 0.78,
    "inputs": {
      "context": 0.78,
      "knowledge": 0.79,
      "experience": 0.75,
      "evaluation": 0.8
    },
    "worker": "qa-worker",
    "trace_seq": 1
  },
  "plan": {
    "id": "PLAN-1037",
    "schema_version": "2020-12.v1",
    "created_at": "2026-03-17T10:00:00Z",
    "task": "SRCH-741",
    "app": "APP-006",
    "intent": "Test_authoring for test-authoring: Async webhook tests need deterministic clocks or they flake.",
    "success_criteria": [
      "Task acceptance criteria met.",
      "No regression of the known failure class.",
      "Applies prior lesson EXP-142"
    ],
    "steps": [
      {
        "n": 1,
        "action": "analyze test-authoring change site",
        "tool": "repo"
      },
      {
        "n": 2,
        "action": "implement test-authoring change",
        "tool": "repo"
      },
      {
        "n": 3,
        "action": "add regression test for Async webhook tests need deterministic c",
        "tool": "repo"
      },
      {
        "n": 4,
        "action": "run tests",
        "tool": "ci",
        "expect": "TR pass"
      },
      {
        "n": 5,
        "action": "open PR",
        "tool": "github"
      }
    ],
    "rollback": "Feature-flag or revert; expand-contract migration if schema touched.",
    "risk_tier": 0,
    "routing": {
      "model_class": "high-reasoning",
      "reason": "tier 0 test-authoring change"
    },
    "applied_experience": [
      "EXP-142"
    ]
  },
  "execution": {
    "id": "EXE-0037",
    "schema_version": "2020-12.v1",
    "created_at": "2026-03-18T14:00:00Z",
    "plan": "PLAN-1037",
    "step": 5,
    "tool": "github",
    "directives": {
      "open_pr": true
    },
    "artifacts": [
      {
        "id": "TR-7037",
        "schema_version": "2020-12.v1",
        "created_at": "2026-03-18T14:00:00Z",
        "artifact_type": "test_run",
        "ref": "TR-7037",
        "uri": "testrail/runs/7037"
      }
    ],
    "status": "succeeded",
    "worker": "qa-worker",
    "run_id": "RUN-0037"
  },
  "evaluation": {
    "id": "EVAL-1037",
    "schema_version": "2020-12.v1",
    "created_at": "2026-03-19T12:00:00Z",
    "execution": "TR-7037",
    "plan": "PLAN-1037",
    "task": "SRCH-741",
    "rubric": {
      "id": "RUBRIC-test_authoring",
      "version": 2
    },
    "objective": [
      {
        "gate": "unit_tests",
        "result": "pass",
        "evidence": "TR-7037",
        "weight": 0.3
      },
      {
        "gate": "coverage",
        "result": "pass",
        "value": 0.83,
        "threshold": 0.8,
        "evidence": "TR-7037",
        "weight": 0.2
      },
      {
        "gate": "dependency_rule",
        "result": "pass",
        "weight": 0.2
      },
      {
        "gate": "security_scan",
        "result": "pass",
        "weight": 0.15
      },
      {
        "gate": "regression_check",
        "result": "pass",
        "weight": 0.15
      }
    ],
    "rubric_items": [
      {
        "item": "test-authoring change is correct and maintainable",
        "result": "pass",
        "evidence": "reviewer notes",
        "judgment_confidence": 0.83
      }
    ],
    "verdict": {
      "outcome": "pass",
      "score": 0.8,
      "outcome_confidence": 0.82,
      "judgment_confidence": 0.83
    },
    "regression_check": {
      "reintroduced_defect": false,
      "checked_against": [
        "EXP-142"
      ]
    }
  },
  "reflection": {
    "id": "REF-1037",
    "schema_version": "2020-12.v1",
    "created_at": "2026-03-19T16:00:00Z",
    "evaluation": "EVAL-1037",
    "execution": "TR-7037",
    "plan": "PLAN-1037",
    "what_happened": "test-authoring task succeeded, applying accumulated experience.",
    "root_cause": {
      "category": "missing_experience",
      "detail": "Applying EXP-142 kept the test-authoring failure class from recurring; loop closed.",
      "confidence": 0.85
    },
    "lessons": [],
    "policy_updates": [],
    "loop_closed_by": "TR-7037"
  },
  "experience_update": {
    "action": "reinforced",
    "experience": "EXP-142",
    "delta": {
      "application_frequency_inc": 1,
      "outcome": "pass"
    }
  },
  "confidence": {
    "context_coverage": 0.78,
    "knowledge_authority": 0.79,
    "experience_applicability": 0.75,
    "evaluation_outcome": 0.8,
    "evaluation_judgment": 0.83,
    "fused": 0.78
  },
  "outcome": "pass"
}
